category,channel_url,channel_id,author,title,video_id,date
A Man Walks About Describing Things,http://www.youtube.com/@DimeStoreAdventures,UCUMQFUkgaEE68_ujIdW2wAw,Dime Store Adventures,The Forgotten Story Of The Occult's Violinist,jCTXw7QZJL4,2025-05-17T17:02:10+00:00
A Man Walks About Describing Things,http://www.youtube.com/@TomScottGo,UCBa659QWEk1AI4Tg--mrJ2A,Tom Scott,"After ten years, it's time to stop weekly videos.",7DKv5H5Frt0,2024-01-01T16:00:06+00:00
A Man Walks About Describing Things,http://www.youtube.com/@AtomicFrontier,UCbCq5Y0WPGimG2jNXhoQxGw,Atomic Frontier,Which Font Makes the Best ⌶-Beam?,azDaPm13CT8,2025-04-10T16:50:23+00:00
A Man Walks About Describing Things,http://www.youtube.com/@JayForeman,UCbbQalJ4OaC0oQ0AqRaOJ9g,Jay Foreman,MAP MEN BOOK - available now!,UQMZTZW56pw,2025-05-22T15:00:00+00:00
A Man Walks About Describing Things,http://www.youtube.com/@TheTimTraveller,UC2LVhJH_9cT2XKp0VAfsKOQ,The Tim Traveller,Slættaratindur: Is The Faroe Islands' Highest Mountain As Tough To Climb As It Is To Pronounce?,g8Y0ahkCLpU,2025-05-26T17:50:02+00:00
A Man Walks About Describing Things,http://www.youtube.com/@RobWords,UC4a9LfdavRlVMaSSWFdIciA,RobWords,Why do people think 'cellar door' is beautiful?,lBbw_DtGbjc,2025-05-19T21:15:51+00:00
Math,http://www.youtube.com/@3blue1brown,UCYO_jab_esuFRV4b17AJtAw,3Blue1Brown,"Summer of Math Exposition #4 | Teachers, I'd love to hear from you",3foYyPDp0Ho,2025-05-05T15:00:08+00:00
Math,http://www.youtube.com/@numberphile,UCoxcjq-8xIDTYp3uz647V5A,Numberphile,A Problem with Infinite Hotel Keys - Numberphile,uezOrcmHzrQ,2025-05-16T10:15:10+00:00
Math,http://www.youtube.com/@standupmaths,UCSju5G2aFaWMqn-_0YBtq5A,Stand-up Maths,Is Mr Beast Cheating His Progress Bars?,uc0OU1yJD-c,2025-05-30T16:52:06+00:00
Math,http://www.youtube.com/@Reducible,UCK8XIGR5kRidIw2fWqwyHRA,Reducible,A* Search: How Your Map Applications Find Shortest Routes,88I6IidylGc,2024-07-27T01:04:19+00:00
Math,http://www.youtube.com/@henryseg,UC4zzTEL5tuIgGMvzjk1Ozbg,Henry Segerman,Geared icosahedron net,EP8KJvk_p_g,2024-12-23T15:35:00+00:00
Math,http://www.youtube.com/@upandatom,UCSIvk78tK2TiviLQn4fSHaw,Up and Atom,The Continuum Hypothesis - The Problem that BROKE Mathematics,Gz6qefUi3Ho,2025-04-09T11:12:31+00:00
Math,http://www.youtube.com/@GeorgeHart-math,UCTl0dASnxto6j2wlVs5Bs2Q,George Hart,A Mathematician's View on Math Education,FfT0ZLSupnY,2024-10-29T21:47:03+00:00
Math,https://www.youtube.com/@tibees,UC52kszkc08-acFOuogFl5jw,Tibees,So what is the fourth dimension anyway?,GB7CL52-JU4,2025-05-29T03:23:42+00:00
Math,https://www.youtube.com/@chalktalkmath/,UCUv35okF8MSo2dFQx5LrNmA,Chalk Talk,"The Problem with Finding ""Hay in a Haystack"" | Everywhere but Nowhere",4weMmFZSBtI,2025-03-22T19:11:42+00:00
Media Commentary,http://www.youtube.com/@RedLetterMedia,UCrTNhL_yO3tPTdQ5XgmmWjA,RedLetterMedia,New Movie Prop Unboxing,dPq2SziB2QY,2025-05-30T12:54:55+00:00
Media Commentary,http://www.youtube.com/@CaptainDisillusion,UCEOXxzW2vU0P-0THehuIIeg,Captain Disillusion,CD / Blur,xDLxFGXuPEc,2025-05-22T16:00:00+00:00
Media Commentary,http://www.youtube.com/@JennyNicholson,UC7-E5xhZBZdW-8d7V80mzfg,Jenny Nicholson,The Spectacular Failure of the Star Wars Hotel,T0CpOYZZZW4,2024-05-18T23:38:48+00:00
Media Commentary,http://www.youtube.com/@RealVirtualFrog,UCZXAVdAplsu1tFZ9OqQhJFg,Virtual Frog,Robot Monster (1953) Review - The Worst Movie Ever Made?,K8qE-8_Gs7U,2025-02-24T17:32:52+00:00
Media Commentary,http://www.youtube.com/@any_austin,UCH_7doiCkWeq0v3ycWE5lDw,Any Austin,Can a 747 Actually Land in GTA5?,llzPppfId3Q,2025-05-18T03:07:01+00:00
Media Commentary,http://www.youtube.com/@JillBearup,UCRrvZqCL1YsqRA8IpXrhYQQ,Jill Bearup,It's Just BAD FANFIC With A 💰BUDGET💰,_8plW8-32Fk,2025-05-13T14:49:44+00:00
Media Commentary,http://www.youtube.com/@lindybeige,UC9pgQfOXRsp4UKrI8q0zjXQ,Lindybeige,Operation Catapult: The Royal Navy's day of infamy?,G_coefvANKY,2025-05-28T11:48:33+00:00
Media Commentary,http://www.youtube.com/@LetsGameItOut,UCto7D1L-MiRoOziCXK9uT5Q,Let's Game It Out,I Made Millions by Openly Ripping Off Every Person Who Hired Me - Cash Cleaner Simulator,e6IO3Yuzkl4,2025-05-28T18:00:37+00:00
Media Commentary,http://www.youtube.com/@DougDoug,UClyGlKOhDUooPJFy4v_mqPg,DougDoug,I turned Peggle into a Roguelike,rLprbptDcwI,2025-05-28T22:23:29+00:00
Media Commentary,http://www.youtube.com/@Danny-Gonzalez,UCSUf5_EPEfl4zlBKZHkZdmw,Danny Gonzalez,Speedrunning Conspiracy Theories w/ @drewisgooden,jtemgoebPPE,2025-05-28T17:01:02+00:00
Media Commentary,http://www.youtube.com/@drewisgooden,UCTSRIY3GLFYIpkR2QwyeklA,Drew Gooden,I watched every SNL movie,wJsFlCQcwrw,2025-03-30T19:26:15+00:00
Food and Cookery,http://www.youtube.com/@aragusea,UC9_p50tH3WmMslWRWKnM7dQ,Adam Ragusea,Why people say beef tallow is healthier (it's prob not),3xvUl4CXIgY,2025-05-29T18:00:04+00:00
Food and Cookery,http://www.youtube.com/@TastingHistory,UCsaGKqPZnGp_7N80hcHySGQ,Tasting History with Max Miller,Civil War Hardtack,l-S3_L38Ttw,2025-05-30T14:01:15+00:00
Food and Cookery,http://www.youtube.com/@babishculinaryuniverse,UCJHA_jMfCvEnv-3kRjTCQXw,Babish Culinary Universe,The ultimate 7-layer dip for BBQ season!,jzZ09CY59RM,2025-05-30T19:00:47+00:00
Food and Cookery,http://www.youtube.com/@foodwishes,UCRIZtPl9nb9RiXc9btSTQNw,Food Wishes,Grilled Whole Fish | Food Wishes,wGxKyW1Bvus,2025-05-30T18:34:42+00:00
Food and Cookery,http://www.youtube.com/@OrdinarySausage,UCJLKwTg0IaSMoq6hLHT3CAA,Ordinary Sausage,Icelandic Lamb Soup Sausage,zjHcp_QtNjU,2025-05-30T17:15:07+00:00
Food and Cookery,http://www.youtube.com/@townsends,UCxr2d4As312LulcajAkKJYw,Townsends,Where Did Your Name Come From? - Live In The Nutmeg Tavern,IRQuE5_vidE,2025-05-30T21:10:32+00:00
The Fan Fandom,http://www.youtube.com/@matthiasrandomstuff2221,UC3_AWXcf2K3l9ILVuQe-XwQ,Matthias random stuff,New computers don't speed up old code,m7PVZixO35c,2025-04-29T13:42:53+00:00
The Fan Fandom,http://www.youtube.com/@MajorHardware,UCUXW4gT27TOaDzKFyN-1tXQ,Major Hardware,I Made a Fan Out of ICE… and Put It in My PC,2V-aw83q5nk,2025-05-23T21:00:05+00:00
The Fan Fandom,http://www.youtube.com/@ThinkingandTinkering,UC4AkVj-qnJxNtKuz3rkq16A,Robert Murray-Smith,2386 A Working Escapement Mechanism,Kt_hbpjjUVM,2025-05-30T16:45:12+00:00
The Fan Fandom,http://www.youtube.com/@TnTOmnibus,UC1E8OmOG17VckoPviOPmkMw,TNT Omnibus,Man In A Shed Episode 10 - The Vortex Wind Turbine Omnibus,5sQY6vM6_gk,2024-12-12T16:59:40+00:00
The Fan Fandom,http://www.youtube.com/@bigclivedotcom,UCtM5z2gkrGRuWd0JQMx76qA,bigclivedotcom,Faulty no-volt relay machine switch,uy2lrpDDNGI,2025-05-29T16:41:47+00:00
The Fan Fandom,http://www.youtube.com/@PlasmaChannel,UCg45A-ph7Eu8jQgfrwDkHLg,Plasma Channel,"Building A 120,000 Volt Ray Gun! (Portable Lightning)",YPE3zpgcqHk,2025-05-30T19:00:29+00:00
Knick Knacks and Thingamajigs,http://www.youtube.com/@ObjectivityVideos,UCtwKon9qMt5YLVgQt1tvJKg,Objectivity,Record Breaking Thermometers - Objectivity 296,K8T6JmCMR_8,2025-04-30T13:17:53+00:00
Knick Knacks and Thingamajigs,http://www.youtube.com/@ashens,UCxt9Pvye-9x_AIcb1UtmF1Q,ashens,Is This the Worst Game Joystick Ever? | Ashens,JeJgQdXbq4s,2025-05-28T20:06:05+00:00
Knick Knacks and Thingamajigs,http://www.youtube.com/@grandillusions,UCnmgSO_4g6QcRzy0yFeglyA,Grand Illusions,Racket In The Attic,sJ8infXuxR4,2025-05-30T11:01:29+00:00
Knick Knacks and Thingamajigs,http://www.youtube.com/@JJMcCullough,UCyhOl6uRlxryALlT5yifldw,J.J. McCullough,The tiny lil' cultural era between the popes,A9q6oEj8_Ds,2025-05-18T18:13:32+00:00
Knick Knacks and Thingamajigs,http://www.youtube.com/@PosyMusic,UCmEmX_jw_pRp5UbAdzkZq-g,Posy,Lamps,PEJnsBeQ_Y8,2025-05-10T10:00:39+00:00
Knick Knacks and Thingamajigs,http://www.youtube.com/@lazyposy,UCfZwJg0C0P-xX7BicmwVKqw,Lazy Posy,Old Speakers as Instruments,Rmo97Ekzncw,2025-03-15T12:35:15+00:00
Knick Knacks and Thingamajigs,http://www.youtube.com/@mitxela,UCeEf90AEmmxaQs5BUkHqR3Q,mitxela,Eurorack Knob Idea,dLw2QQdOLaM,2025-04-24T15:08:06+00:00
Knick Knacks and Thingamajigs,http://www.youtube.com/@ObjectHistory,UC7hlBf8aKs1OFNWEdWsveFA,Object History,Tarot Historical Archetypes: The Star,F1oOuX9mLrE,2025-05-23T13:26:57+00:00
Knick Knacks and Thingamajigs,http://www.youtube.com/@DankPods,UC7Jwj9fkrf1adN4fMmTkpug,DankPods,"The $50 ""Gaming Computer"".",RbvoWwTsY9I,2025-05-25T19:30:10+00:00
Knick Knacks and Thingamajigs,http://www.youtube.com/@Games_for_James,UCx6cailiCkg_mlMM7JX5yfA,James Channel,"Guys, I don’t think this Switch is real…",MAAdKXUvgCo,2025-05-30T18:30:23+00:00
Knick Knacks and Thingamajigs,http://www.youtube.com/@Techmoan,UC5I2hjZYiW9gZPVkvzM8_Cw,Techmoan,The Wand Company's Star Trek Tricorder Replica.,-iMAzdfu1Ms,2025-05-26T14:01:47+00:00
Knick Knacks and Thingamajigs,http://www.youtube.com/@TechnologyConnections,UCy0tKL1T7wFoYcxCe0xjN6Q,Technology Connections,Closed captions on DVDs are getting left behind,OSCOQ6vnLwU,2025-05-27T15:18:23+00:00
Misc Science Commentary,https://www.youtube.com/@StarTalk,UCqoAEDirJPjEUFcF2FklnBA,StarTalk,More Skywatching Tips from Neil deGrasse Tyson,wNWkx1uftH8,2025-05-29T21:45:35+00:00
Misc Science Commentary,http://www.youtube.com/@astropro1,UCDW13ycIiHcl4QVN-YwVy0w,Archive Dive,The Palestinian People Do Have Rights,NLWIw7d-IrY,2025-05-31T04:00:32+00:00
Misc Science Commentary,http://www.youtube.com/@astrumspace,UC-9b7aDP6ZN0coj9-xFnrtw,Astrum,Could China Be on the Verge of a Major Scientific Breakthrough?,XXKCcS2d91g,2025-05-29T16:00:57+00:00
Misc Science Commentary,http://www.youtube.com/@pbsspacetime,UC7_gcs09iThXybpVgjHZ_7g,PBS Space Time,Is Our Model of Dark Energy WRONG? | New 4.2σ Results,WNyY1ZYSzoU,2025-05-29T20:31:10+00:00
Misc Science Commentary,http://www.youtube.com/@whatdamath,UCciQ8wFcVoIIMi-lfu8-cjQ,Anton Petrov,Revealing Bioluminescence: Do Living Bodies Emit Light? #science,VoZAIZZvyhE,2025-05-31T06:00:26+00:00
Misc Science Commentary,http://www.youtube.com/@AmyShiraTeitel,UCw95T_TgbGHhTml4xZ9yIqg,The Vintage Space,Amazon Moon Delivery #shorts #history #space,H8cFcFS-C34,2025-05-30T17:00:18+00:00
Misc Science Commentary,http://www.youtube.com/@acollierastro,UCtscFf8VayggrDYjOwDke_Q,Angela Collier ,the best science podcast isn't what you think,J82N4F4jlDI,2025-05-30T19:00:19+00:00
Misc Science Commentary,http://www.youtube.com/@MinuteEarth,UCeiYXex_fwgYDonaTcSIk6w,MinuteEarth,Not all those who wander are lost - but this bird certainly was!,X6Dl99TZs_A,2025-05-26T12:30:39+00:00
Misc Science Commentary,http://www.youtube.com/@veritasium,UCHnyfMqiRRG1u-2MsSQLbXA,Veritasium,Why do planes fly so high?,zeZddwimLc8,2025-05-21T14:31:31+00:00
Misc Science Commentary,http://www.youtube.com/@PracticalEngineeringChannel,UCMOqf8ab-42UUQIdVoKwjlQ,Practical Engineering,The Most Implausible Tunneling Method,jPJCYrxqyT8,2025-05-20T13:01:19+00:00
Misc Science Commentary,http://www.youtube.com/@smartereveryday,UC6107grRI4m0o2-emgoDnAA,SmarterEveryDay,The Unsolved Mystery of Impact Flashes - Smarter Every Day 307,8nilP--GFLY,2025-03-31T15:19:15+00:00
Misc Science Commentary,http://www.youtube.com/@SteveMould,UCEIwxahdLz7bap-VDs9h35A,Steve Mould,A Bee Under a 360° Drone Microscope!,BvoDuNZ9gLA,2025-05-30T17:00:16+00:00
Misc Science Commentary,http://www.youtube.com/@engineerguyvideo,UC2bkHVIDjXS7sgrgjFtzOXQ,engineerguy,The masterful design of the two-liter plastic soda bottle,kU_gH36GG58,2025-04-11T11:01:19+00:00
Misc Science Commentary,http://www.youtube.com/@SabineHossenfelder,UC1yNl2E66ZzKApQdRuTQ4tw,Sabine Hossenfelder,This New Laser Tech Might Be the Future of Computing,j4H-nK6WMzo,2025-05-29T15:01:20+00:00
Misc Science Commentary,http://www.youtube.com/@MinutePhysics,UCUHW94eEFW7hkUMVaZz4eDg,minutephysics,The Teleprompter Paradox,8LkRMtWfhn4,2025-02-28T14:30:06+00:00
Misc Science Commentary,http://www.youtube.com/@physicsforthebirds,UCeXksuVW8H1x9v4gh7DWoyQ,Physics for the Birds,The Samurai-Toilet Paper Problem,5UNTUO7whzU,2025-03-21T17:09:30+00:00
Misc Science Commentary,http://www.youtube.com/@periodicvideos,UCtESv1e7ntJaLJYKIO1FoYw,Periodic Videos,"Amazing Rare Isotopes (Platinum, Mercury, Gold & more) - Periodic Table of Videos",l85eip4zeew,2025-05-01T13:56:34+00:00
Misc Science Commentary,http://www.youtube.com/@Thoisoi2,UC3j3w-oUtIAm_KI857ydvUA,Thoisoi2 - Chemical Experiments!,Why Everyone Wants This Rare Element?,LsvLkmNq74s,2025-04-26T15:00:28+00:00
Misc Science Commentary,http://www.youtube.com/@illinoisenergyprof6878,UCKH_iLhhkTyt8Dk4dmeCQ9w,Illinois EnergyProf,China's Nuclear Energy Program,5WKQsr9v2C0,2025-05-07T22:58:07+00:00
Misc Science Commentary,http://www.youtube.com/@CGPGrey,UC2C_jShtL725hvbm1arSV9w,CGP Grey,The Simple Secret of Runway Numbers,HSRmfNDk87s,2025-04-14T19:47:51+00:00
Misc Science Commentary,http://www.youtube.com/@kylehill,UCFbtcTaMFnOAP0pFO1L8hVw,Kyle Hill,The Science of DOOM’s Best Moment,AgnDTtEpcxk,2025-05-28T18:00:09+00:00
Misc Science Commentary,http://www.youtube.com/@TheActionLab,UC1VLQPn9cYSqx8plbk9RxxQ,The Action Lab,The Weird Science of Cold Balls,xGih7poxmPo,2025-05-24T15:49:16+00:00
Misc Science Commentary,http://www.youtube.com/@TheDoctorsBjorkman,UCKwQjav6uPCFPIDL6SXjNqQ,The Doctors Bjorkman,OB/GYN's Top 5 Tips for Healing Your Pelvic Floor After Birth,NGkggtFGURk,2025-05-30T10:00:41+00:00
Misc Science Commentary,http://www.youtube.com/@econimate,UCV7OupzIpYe9oIn_QSlyfJw,econimate,Lives vs. Livelihoods: The Impact of Recessions,XrBXo9b2e6g,2025-05-13T15:30:17+00:00
Misc Science Commentary,http://www.youtube.com/@KieranBorovac,UCWul-fy84WOBE_YMcw7uJ9w,Kieran Borovac,When is Easter?,awhGbKH3mGk,2023-02-11T18:05:28+00:00
Misc Science Commentary,http://www.youtube.com/@BennJordan,UCshObcm-nLhbu8MY50EZ5Ng,Benn Jordan,7 Concerning Levels Of Acoustic Spying Techniques,mEC6PM97IRI,2025-05-19T15:00:06+00:00
Misc Science Commentary,http://www.youtube.com/@AlphaPhoenixChannel,UCCWeRTgd79JL0ilH0ZywSJA,AlphaPhoenix,Flying playing cards are weird,zp-Fk_ZiV8Y,2025-03-18T11:01:23+00:00
Misc Science Commentary,http://www.youtube.com/@sirrandalot,UCNq1BjOvgnPx596ddBE3wZQ,sirrandalot,Search the Unsearchable,N6MEauvZYoM,2024-04-01T13:56:38+00:00
Misc Science Commentary,http://www.youtube.com/@MoneyMacro,UCCKpicnIwBP3VPxBAZWDeNA,Money & Macro,Why gen-Z men are turning far right and women far left,lvtZUrpKUlI,2025-05-29T12:01:28+00:00
Misc Science Commentary,http://www.youtube.com/@TheEconomist,UC0p5jTq6Xx_DosDFxVXnWaQ,The Economist,El Salvador's president is locking up his critics,bl82LNd-NTg,2025-05-30T13:30:41+00:00
Misc Science Commentary,http://www.youtube.com/@Physics4Life,UCHa0gEhM-eCT6a0B1w_ZVrw,Physics4Life,I confess I cheated… but can you explain why??  #princetonuniversity #physics department,ZZd0tLghUkw,2025-05-26T16:45:17+00:00
Misc Science Commentary,http://www.youtube.com/@ibx2cat,UCJVnko6tQ56PYB5BNNChPGg,ibx2cat,The UK Officially Signed Away The Chagos Islands,NUhHRwTf0I8,2025-05-23T11:29:04+00:00
Misc Science Commentary,https://www.youtube.com/@FractalPhilosophy,UCDRhoKKIzUZrJPzLCHo9s-w,Fractal Philosophy,Things AI Will Never Understand,F4KQ8wBt1Qg,2025-03-30T23:29:20+00:00
Comedy and the Like,https://www.youtube.com/@JoePeraComedy/,UCfBAKxelvdN2XDFBcofx7Dg,Joe Pera,Aisle of bars,GSMSWZ7fEKY,2025-05-15T21:03:17+00:00
Comedy and the Like,http://www.youtube.com/@JennaMarbles,UC9gFih9rw0zNCK3ZtoKQQyA,JennaMarbles,Making A Dog Birthday Cake,KHCfr7qvkJs,2020-06-18T03:19:54+00:00
Comedy and the Like,http://www.youtube.com/@TheAuntyDonnaChannel,UC_mneEC0wc29EGGmIsN_xLA,Aunty Donna,Is? It? Cake? Aunty Donna's Coffee Cafe is on Netflix AUS/NZ now!,AjncKbmZQnI,2025-05-31T06:01:58+00:00
Comedy and the Like,http://www.youtube.com/@TheDragonsTomb,UC3izYCSBcfi2LfdIr-qg0gQ,The Dragon's Tomb,I'm Deleting My Channel,oOWyOsz-1P8,2025-05-23T13:45:27+00:00
Comedy and the Like,http://www.youtube.com/@TheAlexErnstShow,UCWk68Uw6V990fjnTbcOHeoA,Alex Ernst,An update on my life if you even care,R_RVuv4rEM0,2025-03-21T02:55:30+00:00
Comedy and the Like,http://www.youtube.com/@billwurtz,UCq6aw03lNILzV96UvEAASfQ,bill wurtz,how to pull a rabbit out of a hat,puEXAIiT5wk,2022-11-26T19:54:54+00:00
Comedy and the Like,http://www.youtube.com/@RyansShorts,UC6yeqgmyqhDyMPzE4wwxQig,Ryan's Shorts,"Using The Magic Of A.I. To Win A Medieval Rock, Paper, Scissors Tournament",FwULgyBqBSk,2025-05-29T18:41:51+00:00
Comedy and the Like,http://www.youtube.com/@briandavidgilbert,UCakAg8hC_RFJm4RI3DlD7SA,brian david gilbert,Husky Voice,Sj4BuUWcZ6Y,2025-04-14T17:00:27+00:00
Comedy and the Like,http://www.youtube.com/@Lord_Vinheteiro,UCSE6yilNScIz1SLTNQvrXMw,Vinheteiro,10 Russian Songs You've Heard And Don't Know The Name,MvpRS1NKTKc,2025-05-22T15:45:05+00:00
Comedy and the Like,http://www.youtube.com/@Mattiaskrantz,UCEgm-3RvRn4nCR-fGGVsfdQ,Mattias Krantz,Plays 5000 notes per second!,_pN1UjkfQEY,2025-02-18T18:55:45+00:00
Comedy and the Like,http://www.youtube.com/@SethEverman,UCoNRSwYHJdy-yV1b82ZdHfQ,SethEverman,Goodbye,NUdTPE1SG_A,2023-11-26T19:15:55+00:00
Comedy and the Like,https://www.youtube.com/@SaturdayNightLive,UCqFzWxSCi39LnW1JKFR3efg,Saturday Night Live,Best of Saturday Night Live Season 50,BhA0grF2tRM,2025-05-22T19:00:09+00:00
Animals and Biology,http://www.youtube.com/@BenGThomas,UCDSzwZqgtJEnUzacq3ddoOQ,Ben G Thomas,Who Were The Super-Archaic 'Ghost' Humans?,YXxdRyuZ53A,2025-04-27T19:00:33+00:00
Animals and Biology,http://www.youtube.com/@TREYtheExplainer,UCOuWeOkMrq84u5LY6apWQ8Q,TREY the Explainer,Solving the Cliffhanger that Almost Killed Game of Thrones,QQoNnOGGet0,2025-03-28T15:32:56+00:00
Animals and Biology,http://www.youtube.com/@eons,UCzR-rom72PHN9Zg7RML9EbA,PBS Eons,Is this extinct goat the GOAT?,XmgilWef0Sc,2025-05-29T16:15:03+00:00
Animals and Biology,http://www.youtube.com/@TierZoo,UCHsRtomD4twRf5WVHHk-cMw,TierZoo,The Lizard Tier List - Rapid Fire Edition #animals #wildlife #trendingshorts #tierlist,P63BktoYKQM,2025-05-15T20:05:50+00:00
Animals and Biology,http://www.youtube.com/@SallyLePage,UC9AUeAvdEVJfyS9rd9pvp8g,Sally Le Page,Is all plastic inherently evil?,0t-OA1lym2s,2021-06-14T15:00:02+00:00
Animals and Biology,http://www.youtube.com/@zefrank,UCVpankR4HtoAVtYnFDUieYA,Ze Frank,True Facts: Beetles That Took Things Too Far,spuO7OpS6zw,2025-05-31T04:01:05+00:00
Animals and Biology,http://www.youtube.com/@KQEDDeepLook,UC-3SbfTPJsL8fJAPKiVqBLg,Deep Look,Flatworm Hunters | #DeepLook #Shorts,ClgYXt54dQc,2025-05-29T15:54:07+00:00
Animals and Biology,http://www.youtube.com/@EVNautilus,UC1KOOWHthbQVXH2kZue3_xA,EVNautilus,“Old Man” Sladenia Anglerfish in the Marianas  | Nautilus Live,h1gL7CTzBRQ,2025-05-29T21:00:48+00:00
Animals and Biology,http://www.youtube.com/@BizarreBeasts,UC9Lp_AA5M2cMGrlvnnIns-g,Bizarre Beasts,The Weird Bee That Isn't Social Or Solitary,KNSmgmhxwmc,2025-05-05T14:00:35+00:00
Animals and Biology,http://www.youtube.com/@cmkosemen,UCMy7mRjghOxB8h3nv60SU4w,cmkosemen,🦖💥 How Would an ACTUAL DINOSAUR ATTACK Feel Like? 🌋🩸,Q9iUtMeAFsU,2025-05-26T13:57:25+00:00
Animals and Biology,http://www.youtube.com/@HistoryoftheEarth,UC_aOteuWIY8ITg7DQQspG1g,History of the Earth,How Has Outer Space Shaped Life on Earth?,GfGxqtW5-y4,2024-12-22T20:37:30+00:00
Animals and Biology,http://www.youtube.com/@ClintsReptiles,UCH18915fTE6yZzKrqdea8RQ,Clint's Reptiles,Zoologist Reacts To Viral Animal TikTok,SMY-AzofevE,2025-05-24T12:00:55+00:00
Animals and Biology,http://www.youtube.com/@AronRa,UCAJfDidJyukTekgSRZrjadw,AronRa,Blasphemers Bible - 1 Chronicles 23,mpF4-gQm6Bw,2025-05-31T06:21:44+00:00
Animals and Biology,http://www.youtube.com/@journeytomicro,UCBbnbBWJtwsf0jLGUwX5Q3g,Journey to the Microcosmos,infinite microcosmos 🔬 lofi microbes to relax/study to,_pSdB_DHXaE,2025-05-01T21:21:09+00:00
Animals and Biology,http://www.youtube.com/@Phrenotopia,UCO-8Osf4S3N0m7u1NivTfeg,Phrenotopia,The Vertebrate Recipe | Alien Biosphere Evolution #9,EK_gMZ9GfPg,2024-11-22T17:00:06+00:00
Animals and Biology,http://www.youtube.com/@octolabtv1168,UCNo_xQ7NvTr31naPAcjQWjg,Octolab TV,Octopus Christmas Tree Shopping,vrthz3HdlPE,2021-12-25T16:08:17+00:00
Animals and Biology,http://www.youtube.com/@KOTARO_OTTER,UCDYyCQAk60CqabvkL5gU3Mw,KOTSUMET,やきとり焼いてたらカワウソが匂いにつられてやって来た　Otters Eat BBQ for the First Time,GGfyvt397eI,2025-05-24T11:00:28+00:00
Animals and Biology,http://www.youtube.com/@NinjaFrog777,UCrJH2Wy7PmCiitXKJ21yh4w,Ninja Frog,Google Pixel 9 Pro XL meets Small Round Frogs,mnub7UHkHmw,2024-09-22T09:30:23+00:00
Animals and Biology,http://www.youtube.com/@cruiser1228,UCWIxPuO_0emPbma8UlOc3JQ,Cruiser,Moose strolling on Naknek River May 30 2025 explore.org,0T0un_T0Fo0,2025-05-30T13:45:39+00:00
Animals and Biology,http://www.youtube.com/@cherylb4420,UCpjhDz9Sqn-6h1ZwtvUiA2g,Cheryl B,11/4/2022 LS Young Polar bears playing Explore.org,3Z78ZvO4_nk,2022-11-06T05:27:53+00:00
Animals and Biology,http://www.youtube.com/@Mr.Frog.,UCWUH_hdDfzi98i3clGbh_Ww,Mr. Frog,Life won’t wait！frog vs toad.,HXdc1cFi-_s,2024-12-21T23:56:31+00:00
Animals and Biology,http://www.youtube.com/@HomuraHam,UCKwcMBhbzQXgSM1T3TvHmiA,Homura Ham,Epic Hamster Escape – Crazy Mazes & Obstacles 🐹 Homura Ham,8nv2opx2t1c,2025-05-31T04:08:07+00:00
Animals and Biology,http://www.youtube.com/@TheUrbanRescueRanch,UCv3mh2P-q3UCtR9-2q8B-ZA,The Urban Rescue Ranch,Poppy Returns,ikvMHYm-klQ,2025-05-03T00:54:00+00:00
Animals and Biology,http://www.youtube.com/@LOUTRE,UCz6yuUg6N0iRiFhCLmXrNJQ,LOUTRE,ラブラブすぎるカワウソ #shorts,B6vrFEIHieM,2025-05-30T12:11:43+00:00
Animals and Biology,http://www.youtube.com/@Bradybrandwood,UCj2Eeg01Mn5WmcXxt695fUg,Brady Brandwood,I Put 6 Cameras In An Old Abandoned House,_Tm-6Y48Q74,2025-05-27T18:23:17+00:00
Animals and Biology,http://www.youtube.com/@FOBBVCAM,UCsFgbVuhRrPV5FqyN7kOD8g,FOBBV CAM,5-28-2025 Sunny On the High Perch … No Fledge Yet!,ZGpQZLrNUQQ,2025-05-30T03:39:27+00:00
Animals and Biology,http://www.youtube.com/@wrinkletheduck,UCPPjuJTt9jiOZNHScvEmvRg,seDUCKtive,Wrinkle goes to Michaels (arts&crafts) - short version,IeKnfxUp5GM,2025-05-25T13:20:36+00:00
Animals and Biology,http://www.youtube.com/@ApolloandFrens,UCnUdaxbBMPQ9o9KVz7Oa6eQ,Apollo and Frens,Fresh Water or Gaslight 🤔,3IsbAkJfjiw,2025-05-29T14:56:47+00:00
Animals and Biology,http://www.youtube.com/@davidmbird,UC6q7I1DD2Jv5Ur9UEIavIrA,Becorns | David M Bird,Springtime Hats!,CdtZMFYI_Uw,2025-05-19T15:00:14+00:00
Animals and Biology,http://www.youtube.com/@LesleytheBirdNerd,UCDjdXwT-KrFPsqOSg4KL8Nw,Lesley the Bird Nerd,Wait… What Was I Doing Again? Chickadee Confusion in the Nest Box | Inky and Philbert,hN1ZR6fITiQ,2025-05-29T23:15:03+00:00
Animals and Biology,http://www.youtube.com/@MyBackyardBirding,UCcNyzOCKvyMBaA4iQVgO9EQ,MyBackyardBirding,Mourning Doves Take Care of Each Other,KZlx3DVXKvk,2025-05-28T16:00:56+00:00
Animals and Biology,https://www.youtube.com/@OctopusLady,UC8_YhCUr_HRsLAtSddGeFcw,The Octopus Lady,The Bizarrely Violent World of Clam Smuggling,-gmVnHL1k0M,2025-05-09T18:53:50+00:00
Making Things (Chaotic),https://www.youtube.com/@williamosman,UCfMJ2MchTSW2kWaT0kK94Yw,William Osman,i tried increasing my pain tolerance,yw67_k6oDQY,2025-04-16T21:56:05+00:00
Making Things (Chaotic),http://www.youtube.com/@MichaelReeves,UCtHaxi4GTYDpJgMSGy7AeSw,Michael Reeves,A Bot that Scams People,LwOITqr_fz4,2025-02-06T17:48:22+00:00
Making Things (Chaotic),http://www.youtube.com/@styropyro,UCJYJgj7rzsn0vdR7fkgjuIA,styropyro,2025 world's strongest handheld laser,UBVlL0FNbSE,2025-05-30T18:00:10+00:00
Making Things (Chaotic),http://www.youtube.com/@WilliamOsman2,UCbguawtJlHjxXzdAskubQVg,William Osman 2,farmer vs nilered,7hu7h2iD0YM,2025-05-24T13:30:09+00:00
Making Things (Chaotic),http://www.youtube.com/@allenpan,UCVS89U86PwqzNkK2qYNbk5A,Allen Pan,American Style Chopsticks,DFHLBvtF2IQ,2025-02-14T23:39:26+00:00
Making Things (Chaotic),http://www.youtube.com/@Ididathing,UCJLZe_NoiG0hT7QCX_9vmqw,I did a thing,Can I Survive A Wildfire By Hiding In A Bath?,TcHdXpi0MSc,2025-05-20T14:00:49+00:00
Making Things (Chaotic),http://www.youtube.com/@ElectroBOOM,UCJ0-OtVpF0wOKEqT2Z1HEtA,ElectroBOOM,AFCI Breaker Fights Electrical Fire!,uz6xrE8WZHc,2025-05-30T16:01:10+00:00
Making Things (Chaotic),http://www.youtube.com/@Glarses,UCFtOX-21N1earf-K58C7HjQ,Glarses,building a keyboard with my little bro,vR_Nbco2lNQ,2025-05-21T18:09:50+00:00
Making Things (Chaotic),http://www.youtube.com/@ExtractionsAndIre,UCvFApMFo_AafXbHRyEJefjA,Extractions&Ire,Making Pigment: Forging a New Yellow through Chemistry,s-VrZ3it270,2025-05-25T23:58:32+00:00
Making Things (Chaotic),http://www.youtube.com/@ExplosionsAndFire,UCVovvq34gd0ps5cVYNZrc7A,Explosions&Fire,dont send that Plutonium guy to jail,M0JGsSxBd2I,2025-04-05T00:44:47+00:00
Making Things (Chaotic),http://www.youtube.com/@NileRed2,UCA0mlN90EHCizvo101nbr-g,NileRed 2,This is what REALLY happened at Polaroid,7Jkbug2l9K8,2023-04-04T21:15:30+00:00
Making Things (Chaotic),http://www.youtube.com/@NileBlue,UC1D3yD4wlPMico0dss264XA,NileBlue,Turning my face into a cookie,seepF2s3kic,2025-05-24T19:31:24+00:00
Making Things of Various Sorts,http://www.youtube.com/@StuffMadeHere,UCj1VqrHhDte54oLgPG4xpuQ,Stuff Made Here,I really thought this would fly well,BO_YGcSzJdA,2025-03-04T01:05:20+00:00
Making Things of Various Sorts,http://www.youtube.com/@NileRed,UCFhXFikryT4aFcLkLw2LBLA,NileRed,Using a cabbage to do some chemistry,EB9VT3hcETE,2025-05-28T16:08:41+00:00
Making Things of Various Sorts,http://www.youtube.com/@thethoughtemporium,UCV5vCi3jPJdURZwAOO_FNfQ,The Thought Emporium,Growing Penicillin from a SLAB of Mold,aWah0ipEllM,2025-05-12T17:24:33+00:00
Making Things of Various Sorts,http://www.youtube.com/@tom7,UC3azLjQuz9s5qk76KEXaTvA,suckerpinch,Badness 0 (Apostrophe‛s version),Y65FRxE7uMc,2024-06-07T01:15:12+00:00
