category,channel_url,channel_id,author,title,video_id,date
A Man Walks About Describing Things,http://www.youtube.com/@DimeStoreAdventures,UCUMQFUkgaEE68_ujIdW2wAw,Dime Store Adventures,"A Video About A Sport From The 1920's Called ""Balloon Jumping""",dNW2tJi75FY,2025-08-15T04:21:07+00:00
A Man Walks About Describing Things,http://www.youtube.com/@TomScottGo,UCBa659QWEk1AI4Tg--mrJ2A,Tom Scott,"After ten years, it's time to stop weekly videos.",7DKv5H5Frt0,2024-01-01T16:00:06+00:00
A Man Walks About Describing Things,http://www.youtube.com/@AtomicFrontier,UCbCq5Y0WPGimG2jNXhoQxGw,Atomic Frontier,What if sailing had no rules?,kk4AV3d4v3E,2025-07-26T13:43:09+00:00
A Man Walks About Describing Things,http://www.youtube.com/@JayForeman,UCbbQalJ4OaC0oQ0AqRaOJ9g,Jay Foreman,Ordnance Survey let us change the map of Britain,jI87uB_G6As,2025-06-30T15:00:11+00:00
A Man Walks About Describing Things,http://www.youtube.com/@TheTimTraveller,UC2LVhJH_9cT2XKp0VAfsKOQ,The Tim Traveller,Why French Railway Stations Delayed Their Clocks (& What Happened When They Did),PELruSTO3qI,2025-07-25T11:30:43+00:00
A Man Walks About Describing Things,http://www.youtube.com/@RobWords,UC4a9LfdavRlVMaSSWFdIciA,RobWords,The curious origins of imperial and metric units,pM3c328VifA,2025-08-02T13:01:34+00:00
Math,http://www.youtube.com/@3blue1brown,UCYO_jab_esuFRV4b17AJtAw,3Blue1Brown,But how do AI images/videos actually work? | Guest video by @WelchLabsVideo,iv-5mZ_9CPY,2025-07-25T12:14:11+00:00
Math,http://www.youtube.com/@numberphile,UCoxcjq-8xIDTYp3uz647V5A,Numberphile,The Holey Monster (with 934 faces) - Numberphile,BhSlqIe1CRQ,2025-07-31T12:09:49+00:00
Math,http://www.youtube.com/@standupmaths,UCSju5G2aFaWMqn-_0YBtq5A,Stand-up Maths,These pixels count themselves.,nsj3gTGh9K0,2025-07-31T19:52:33+00:00
Math,http://www.youtube.com/@Reducible,UCK8XIGR5kRidIw2fWqwyHRA,Reducible,A* Search: How Your Map Applications Find Shortest Routes,88I6IidylGc,2024-07-27T01:04:19+00:00
Math,http://www.youtube.com/@henryseg,UC4zzTEL5tuIgGMvzjk1Ozbg,Henry Segerman,Expanding racks,iWknov3Xpts,2025-06-09T12:43:45+00:00
Math,http://www.youtube.com/@upandatom,UCSIvk78tK2TiviLQn4fSHaw,Up and Atom,These 17 Paradoxes Will Change How You See the Universe,yrJA0J7jciY,2025-06-19T02:13:34+00:00
Math,http://www.youtube.com/@GeorgeHart-math,UCTl0dASnxto6j2wlVs5Bs2Q,George Hart,A Mathematician's View on Math Education,FfT0ZLSupnY,2024-10-29T21:47:03+00:00
Math,https://www.youtube.com/@tibees,UC52kszkc08-acFOuogFl5jw,Tibees,"In hyperspace, no one can hear you scream",304fnS0VpuA,2025-08-14T07:48:58+00:00
Math,https://www.youtube.com/@chalktalkmath/,UCUv35okF8MSo2dFQx5LrNmA,Chalk Talk,Astonishing discovery by computer scientist: how to squeeze space into time,8JuWdXrCmWg,2025-06-07T06:27:27+00:00
Media Commentary,http://www.youtube.com/@RedLetterMedia,UCrTNhL_yO3tPTdQ5XgmmWjA,RedLetterMedia,Half in the Bag: Weapons,sTejjm8P25E,2025-08-09T21:14:39+00:00
Media Commentary,http://www.youtube.com/@CaptainDisillusion,UCEOXxzW2vU0P-0THehuIIeg,Captain Disillusion,Find me at OpenSauce... before Captain Disillusion does!,grn3X4IMx54,2025-07-09T17:23:48+00:00
Media Commentary,http://www.youtube.com/@JennyNicholson,UC7-E5xhZBZdW-8d7V80mzfg,Jenny Nicholson,The Spectacular Failure of the Star Wars Hotel,T0CpOYZZZW4,2024-05-18T23:38:48+00:00
Media Commentary,http://www.youtube.com/@RealVirtualFrog,UCZXAVdAplsu1tFZ9OqQhJFg,Virtual Frog,Robot Monster (1953) Review - The Worst Movie Ever Made?,K8qE-8_Gs7U,2025-02-24T17:32:52+00:00
Media Commentary,http://www.youtube.com/@any_austin,UCH_7doiCkWeq0v3ycWE5lDw,Any Austin,Do GTA5's Street Signs Comply With California Law?,hEGYRbiVk3Y,2025-08-15T19:58:42+00:00
Media Commentary,http://www.youtube.com/@JillBearup,UCRrvZqCL1YsqRA8IpXrhYQQ,Jill Bearup,⚔️Everything⚔️ is ❌FAKE❌,yJ4TAddLeA0,2025-08-11T11:27:29+00:00
Media Commentary,http://www.youtube.com/@lindybeige,UC9pgQfOXRsp4UKrI8q0zjXQ,Lindybeige,An American song sung by a Brit,vF_oYA6ZHzM,2025-07-19T23:46:00+00:00
Media Commentary,http://www.youtube.com/@LetsGameItOut,UCto7D1L-MiRoOziCXK9uT5Q,Let's Game It Out,I Became a Millionaire Running a Mail Service with a 0.03% Delivery Success Rate -  Parcel Simulator,UuMFCfixvRw,2025-08-10T15:00:48+00:00
Media Commentary,http://www.youtube.com/@DougDoug,UClyGlKOhDUooPJFy4v_mqPg,DougDoug,TSA told me i have a big _______,8AE2mEgknvk,2025-08-13T23:20:45+00:00
Media Commentary,http://www.youtube.com/@Danny-Gonzalez,UCSUf5_EPEfl4zlBKZHkZdmw,Danny Gonzalez,I Got Hypnotized To See If It's Fake,bXFkSEGafmo,2025-07-31T19:04:07+00:00
Media Commentary,http://www.youtube.com/@drewisgooden,UCTSRIY3GLFYIpkR2QwyeklA,Drew Gooden,The internet made me obsessed with protein,SCkP9VVxKSE,2025-07-18T21:32:17+00:00
Food and Cookery,http://www.youtube.com/@aragusea,UC9_p50tH3WmMslWRWKnM7dQ,Adam Ragusea,Chocolate meringue cookies — no flour,LdZcjgeKL9E,2025-08-14T18:21:04+00:00
Food and Cookery,http://www.youtube.com/@TastingHistory,UCsaGKqPZnGp_7N80hcHySGQ,Tasting History with Max Miller,Is this the Original Caesar Salad?,SyLma7bM1wA,2025-08-15T14:00:47+00:00
Food and Cookery,http://www.youtube.com/@babishculinaryuniverse,UCJHA_jMfCvEnv-3kRjTCQXw,Babish Culinary Universe,Creme brûlée but make it matcha!,_DAiZ8sk6uo,2025-08-14T19:30:07+00:00
Food and Cookery,http://www.youtube.com/@foodwishes,UCRIZtPl9nb9RiXc9btSTQNw,Food Wishes,Mississippi Chicken Chili | Food Wishes,QMiNcwZ9Aks,2025-08-15T17:34:47+00:00
Food and Cookery,http://www.youtube.com/@OrdinarySausage,UCJLKwTg0IaSMoq6hLHT3CAA,Ordinary Sausage,Mouth Numbing Szechuan Peppercorn Sausage with Mrs. Hand Sausage,bKfGcnC2ww0,2025-08-15T17:15:05+00:00
Food and Cookery,http://www.youtube.com/@townsends,UCxr2d4As312LulcajAkKJYw,Townsends,A Soldier's Daily Ration - Live In The Nutmeg Tavern,U6tDBV8ftzc,2025-08-15T21:22:09+00:00
The Fan Fandom,http://www.youtube.com/@matthiasrandomstuff2221,UC3_AWXcf2K3l9ILVuQe-XwQ,Matthias random stuff,"Fnirsi DPOS350P: I like the scope, but some features seem unfinished",dcexJ4CTvOg,2025-07-03T15:34:40+00:00
The Fan Fandom,http://www.youtube.com/@MajorHardware,UCUXW4gT27TOaDzKFyN-1tXQ,Major Hardware,Infinite 3D Printing? | Hictop Automatic Build Plate Changer,AXapWm7ikP4,2025-07-26T13:00:30+00:00
The Fan Fandom,http://www.youtube.com/@ThinkingandTinkering,UC4AkVj-qnJxNtKuz3rkq16A,Robert Murray-Smith,2423 Impossible Gears 5,BPY8k2_zMi8,2025-08-15T15:14:09+00:00
The Fan Fandom,http://www.youtube.com/@TnTOmnibus,UC1E8OmOG17VckoPviOPmkMw,TNT Omnibus,Man In A Shed Episode 10 - The Vortex Wind Turbine Omnibus,5sQY6vM6_gk,2024-12-12T16:59:40+00:00
The Fan Fandom,http://www.youtube.com/@bigclivedotcom,UCtM5z2gkrGRuWd0JQMx76qA,bigclivedotcom,Building a digital clock kit with no microcontroller,0hwWnPxKU14,2025-08-14T13:45:29+00:00
The Fan Fandom,http://www.youtube.com/@PlasmaChannel,UCg45A-ph7Eu8jQgfrwDkHLg,Plasma Channel,I Replicated The Physics Of Sandstorm Lightning,ZCTvlbNyjBg,2025-08-15T20:00:24+00:00
Knick Knacks and Thingamajigs,http://www.youtube.com/@ObjectivityVideos,UCtwKon9qMt5YLVgQt1tvJKg,Objectivity,The Explosive Paper (feat. Veritasium) - Objectivity 298,CQmFXgXsMEc,2025-07-10T12:18:06+00:00
Knick Knacks and Thingamajigs,http://www.youtube.com/@ashens,UCxt9Pvye-9x_AIcb1UtmF1Q,ashens,Figures You've Probably Not Heard of: Dempsey and Makepeace | Ashens,LnOvyyGyLLo,2025-07-30T20:36:36+00:00
Knick Knacks and Thingamajigs,http://www.youtube.com/@grandillusions,UCnmgSO_4g6QcRzy0yFeglyA,Grand Illusions,Tim Heads North,0dQKMdsX_GU,2025-08-15T11:00:02+00:00
Knick Knacks and Thingamajigs,http://www.youtube.com/@JJMcCullough,UCyhOl6uRlxryALlT5yifldw,J.J. McCullough,"""Alberta separatism"" isn't real",v55Om6Lfj_c,2025-08-15T16:45:18+00:00
Knick Knacks and Thingamajigs,http://www.youtube.com/@PosyMusic,UCmEmX_jw_pRp5UbAdzkZq-g,Posy,Splat HiFi,J1-yToxKOzI,2025-07-26T10:00:33+00:00
Knick Knacks and Thingamajigs,http://www.youtube.com/@lazyposy,UCfZwJg0C0P-xX7BicmwVKqw,Lazy Posy,Gaussian Splatting as visual effect,eekCQQYwlgA,2025-07-26T10:01:04+00:00
Knick Knacks and Thingamajigs,http://www.youtube.com/@mitxela,UCeEf90AEmmxaQs5BUkHqR3Q,mitxela,Precision Clock Mk IV,XL2cZjO5IUY,2025-05-31T14:19:23+00:00
Knick Knacks and Thingamajigs,http://www.youtube.com/@ObjectHistory,UC7hlBf8aKs1OFNWEdWsveFA,Object History,Old man dances above Paris,CoZRICi_0Vo,2025-08-14T21:35:44+00:00
Knick Knacks and Thingamajigs,http://www.youtube.com/@DankPods,UC7Jwj9fkrf1adN4fMmTkpug,DankPods,The iFlops iPod Monkey.,B6aPBRqHcBE,2025-08-09T14:28:01+00:00
Knick Knacks and Thingamajigs,http://www.youtube.com/@Games_for_James,UCx6cailiCkg_mlMM7JX5yfA,James Channel,Bootleg Bonanza the Second!,qxctoDfy0WI,2025-07-25T15:30:27+00:00
Knick Knacks and Thingamajigs,http://www.youtube.com/@Techmoan,UC5I2hjZYiW9gZPVkvzM8_Cw,Techmoan,Sony PS-FL99 vinyl record player with an unusual digital feature.,RPsa9O1PFhY,2025-08-09T09:34:35+00:00
Knick Knacks and Thingamajigs,http://www.youtube.com/@TechnologyConnections,UCy0tKL1T7wFoYcxCe0xjN6Q,Technology Connections,VHS-C: when a lazy idea stumbles towards perfection,HFYWHeBhYbM,2025-08-13T17:38:13+00:00
Misc Science Commentary,https://www.youtube.com/@StarTalk,UCqoAEDirJPjEUFcF2FklnBA,StarTalk,Does Earth have cycles of Global Warming?,H8L9Xaap_6s,2025-08-14T19:45:35+00:00
Misc Science Commentary,http://www.youtube.com/@astropro1,UCDW13ycIiHcl4QVN-YwVy0w,Archive Dive,Tomorrow is Ours,_m4u8OKYzN4,2025-08-16T04:00:50+00:00
Misc Science Commentary,http://www.youtube.com/@astrumspace,UC-9b7aDP6ZN0coj9-xFnrtw,Astrum,Something's Wrong. This Black Hole Is Swallowing Matter At an Impossible Rate,BpkJOWlxTMw,2025-08-15T16:06:50+00:00
Misc Science Commentary,http://www.youtube.com/@pbsspacetime,UC7_gcs09iThXybpVgjHZ_7g,PBS Space Time,Is There Evidence For a Vast Multiverse?,Ivye51d5Vis,2025-08-14T20:45:01+00:00
Misc Science Commentary,http://www.youtube.com/@whatdamath,UCciQ8wFcVoIIMi-lfu8-cjQ,Anton Petrov,Black Hole at the Maximum Mass Limit Confirmed Inside the Cosmic Horseshoe,-KNxKYgjU9c,2025-08-15T22:00:00+00:00
Misc Science Commentary,http://www.youtube.com/@AmyShiraTeitel,UCw95T_TgbGHhTml4xZ9yIqg,The Vintage Space,People had questions #shorts #history,sueTkL48clE,2025-08-15T15:25:41+00:00
Misc Science Commentary,http://www.youtube.com/@acollierastro,UCtscFf8VayggrDYjOwDke_Q,Angela Collier ,Red Flag Romance: 90s Country Edition,hn4HHF1w6-E,2025-08-05T19:30:13+00:00
Misc Science Commentary,http://www.youtube.com/@MinuteEarth,UCeiYXex_fwgYDonaTcSIk6w,MinuteEarth,Would you eat Mammoth Meat?,wt-xBLKzqM0,2025-08-12T19:00:51+00:00
Misc Science Commentary,http://www.youtube.com/@veritasium,UCHnyfMqiRRG1u-2MsSQLbXA,Veritasium,Testing the US Military’s worst idea,y2y8ME02lX4,2025-08-14T13:00:01+00:00
Misc Science Commentary,http://www.youtube.com/@PracticalEngineeringChannel,UCMOqf8ab-42UUQIdVoKwjlQ,Practical Engineering,Why Are There No Short Arch Dams?,_R0xPffklXQ,2025-08-05T13:01:04+00:00
Misc Science Commentary,http://www.youtube.com/@smartereveryday,UC6107grRI4m0o2-emgoDnAA,SmarterEveryDay,I Went Into a Nuclear Plant and It Changed How I Think About Radiation - Smarter Every Day 309,cRaKMTK7ea0,2025-07-13T14:00:11+00:00
Misc Science Commentary,http://www.youtube.com/@SteveMould,UCEIwxahdLz7bap-VDs9h35A,Steve Mould,This a Chinese magic mirror,iDsb-pxE3fA,2025-08-15T19:00:40+00:00
Misc Science Commentary,http://www.youtube.com/@engineerguyvideo,UC2bkHVIDjXS7sgrgjFtzOXQ,engineerguy,The masterful design of the two-liter plastic soda bottle,kU_gH36GG58,2025-04-11T11:01:19+00:00
Misc Science Commentary,http://www.youtube.com/@SabineHossenfelder,UC1yNl2E66ZzKApQdRuTQ4tw,Sabine Hossenfelder,"Scientific research has big problems, and it's getting worse",9yPy3DeMUyI,2025-08-14T15:00:26+00:00
Misc Science Commentary,http://www.youtube.com/@MinutePhysics,UCUHW94eEFW7hkUMVaZz4eDg,minutephysics,How to STOP Water From Freezing,6c7JoCZmqC4,2025-08-15T18:18:19+00:00
Misc Science Commentary,http://www.youtube.com/@physicsforthebirds,UCeXksuVW8H1x9v4gh7DWoyQ,Physics for the Birds,The Physics of Multiphonics in Woodwinds,lge2mKSRI1Y,2025-08-14T22:34:08+00:00
Misc Science Commentary,http://www.youtube.com/@periodicvideos,UCtESv1e7ntJaLJYKIO1FoYw,Periodic Videos,RIP Tom Lehrer (The Elements Song) - Periodic Table of Videos,uu6c8CRRvqU,2025-08-11T13:55:48+00:00
Misc Science Commentary,http://www.youtube.com/@Thoisoi2,UC3j3w-oUtIAm_KI857ydvUA,Thoisoi2 - Chemical Experiments!,What Happens When You Heat Metal to 15000 °C?,ewezJVNnego,2025-07-12T14:37:32+00:00
Misc Science Commentary,http://www.youtube.com/@illinoisenergyprof6878,UCKH_iLhhkTyt8Dk4dmeCQ9w,Illinois EnergyProf,China's Nuclear Energy Program,5WKQsr9v2C0,2025-05-07T22:58:07+00:00
Misc Science Commentary,http://www.youtube.com/@CGPGrey,UC2C_jShtL725hvbm1arSV9w,CGP Grey,The Simple Secret of Runway Numbers,HSRmfNDk87s,2025-04-14T19:47:51+00:00
Misc Science Commentary,http://www.youtube.com/@kylehill,UCFbtcTaMFnOAP0pFO1L8hVw,Kyle Hill,RADIOACTIVE WASPS Found at Nuclear Site?,nGoDCa9vPfA,2025-08-14T16:01:29+00:00
Misc Science Commentary,http://www.youtube.com/@TheActionLab,UC1VLQPn9cYSqx8plbk9RxxQ,The Action Lab,Volumetric 3D Printing Is REALLY FAST,L7QnADt04ZU,2025-08-09T15:37:09+00:00
Misc Science Commentary,http://www.youtube.com/@TheDoctorsBjorkman,UCKwQjav6uPCFPIDL6SXjNqQ,The Doctors Bjorkman,"Pediatrician Guide to the 4-Month Sleep Regression,  Feeding, and Development",0SkFjOJW7Eo,2025-08-13T13:00:01+00:00
Misc Science Commentary,http://www.youtube.com/@econimate,UCV7OupzIpYe9oIn_QSlyfJw,econimate,Food Policy in a Warming World,dWA3hhAibag,2025-07-10T15:58:59+00:00
Misc Science Commentary,http://www.youtube.com/@KieranBorovac,UCWul-fy84WOBE_YMcw7uJ9w,Kieran Borovac,When is Easter?,awhGbKH3mGk,2023-02-11T18:05:28+00:00
Misc Science Commentary,http://www.youtube.com/@BennJordan,UCshObcm-nLhbu8MY50EZ5Ng,Benn Jordan,"Ackchyually...Sorry @charlieputh , I just couldn't help myself. 😂 #528hz #pseudoscience",0qz7z7w5-iw,2025-08-04T04:00:29+00:00
Misc Science Commentary,http://www.youtube.com/@AlphaPhoenixChannel,UCCWeRTgd79JL0ilH0ZywSJA,AlphaPhoenix,I weighed an airplane... while it was flying!,hnvtstq3ztI,2025-06-17T10:01:13+00:00
Misc Science Commentary,http://www.youtube.com/@sirrandalot,UCNq1BjOvgnPx596ddBE3wZQ,sirrandalot,Search the Unsearchable,N6MEauvZYoM,2024-04-01T13:56:38+00:00
Misc Science Commentary,http://www.youtube.com/@MoneyMacro,UCCKpicnIwBP3VPxBAZWDeNA,Money & Macro,Economist reacts to Tiktoks about the economy,uS8Wn5-oFaM,2025-08-08T12:45:42+00:00
Misc Science Commentary,http://www.youtube.com/@TheEconomist,UC0p5jTq6Xx_DosDFxVXnWaQ,The Economist,The Alaska summit was a symbolic victory for Putin,yzcOxYUkzec,2025-08-16T03:30:46+00:00
Misc Science Commentary,http://www.youtube.com/@Physics4Life,UCHa0gEhM-eCT6a0B1w_ZVrw,Physics4Life,The TRUE meaning of Newton's Laws,ASzd_CT7Q64,2025-07-11T15:02:21+00:00
Misc Science Commentary,http://www.youtube.com/@ibx2cat,UCJVnko6tQ56PYB5BNNChPGg,ibx2cat,How Did Humans Get Here?,Cc2_dL30kws,2025-08-14T10:46:17+00:00
Misc Science Commentary,https://www.youtube.com/@FractalPhilosophy,UCDRhoKKIzUZrJPzLCHo9s-w,Fractal Philosophy,40 Minutes of Simulated Empires,H5ydPSB2wWM,2025-06-21T07:14:11+00:00
Comedy and the Like,https://www.youtube.com/@JoePeraComedy/,UCfBAKxelvdN2XDFBcofx7Dg,Joe Pera,"The Origins of Bob Seger’s Album Art, from ‘Drifting Off Live’ show",5tPf5FpaS28,2025-08-15T16:11:43+00:00
Comedy and the Like,http://www.youtube.com/@JennaMarbles,UC9gFih9rw0zNCK3ZtoKQQyA,JennaMarbles,Making A Dog Birthday Cake,KHCfr7qvkJs,2020-06-18T03:19:54+00:00
Comedy and the Like,http://www.youtube.com/@TheAuntyDonnaChannel,UC_mneEC0wc29EGGmIsN_xLA,Aunty Donna,The Sandwich Man,Kw_8v55F_g0,2025-08-15T00:49:21+00:00
Comedy and the Like,http://www.youtube.com/@TheDragonsTomb,UC3izYCSBcfi2LfdIr-qg0gQ,The Dragon's Tomb,This game is a SCAM,JCU7rq0DHr0,2025-08-05T12:11:35+00:00
Comedy and the Like,http://www.youtube.com/@TheAlexErnstShow,UCWk68Uw6V990fjnTbcOHeoA,Alex Ernst,Rigged system,8uIEwLoliqI,2025-07-07T04:14:14+00:00
Comedy and the Like,http://www.youtube.com/@billwurtz,UCq6aw03lNILzV96UvEAASfQ,bill wurtz,how to pull a rabbit out of a hat,puEXAIiT5wk,2022-11-26T19:54:54+00:00
Comedy and the Like,http://www.youtube.com/@RyansShorts,UC6yeqgmyqhDyMPzE4wwxQig,Ryan's Shorts,Waterfall Pod: The Only Podcast Filmed At The Base Of A Waterfall,b8nZksEcyw4,2025-08-05T19:59:53+00:00
Comedy and the Like,http://www.youtube.com/@briandavidgilbert,UCakAg8hC_RFJm4RI3DlD7SA,brian david gilbert,Husky Voice,Sj4BuUWcZ6Y,2025-04-14T17:00:27+00:00
Comedy and the Like,http://www.youtube.com/@Lord_Vinheteiro,UCSE6yilNScIz1SLTNQvrXMw,Vinheteiro,Chopin on Bösendorfer,1wV0oGKDOVc,2025-08-06T15:15:00+00:00
Comedy and the Like,http://www.youtube.com/@Mattiaskrantz,UCEgm-3RvRn4nCR-fGGVsfdQ,Mattias Krantz,Teaching an octopus piano,4Cd2-2f7YsU,2025-07-26T08:47:09+00:00
Comedy and the Like,http://www.youtube.com/@SethEverman,UCoNRSwYHJdy-yV1b82ZdHfQ,SethEverman,Goodbye,NUdTPE1SG_A,2023-11-26T19:15:55+00:00
Comedy and the Like,https://www.youtube.com/@SaturdayNightLive,UCqFzWxSCi39LnW1JKFR3efg,Saturday Night Live,there’s nothing more rebellious than dancing in the middle of the street,w0W8LOtSSTM,2025-08-08T20:31:25+00:00
Animals and Biology,http://www.youtube.com/@BenGThomas,UCDSzwZqgtJEnUzacq3ddoOQ,Ben G Thomas,Every Time Things Have Evolved Into Sloths,r7pzCL5dnAU,2025-08-10T21:00:49+00:00
Animals and Biology,http://www.youtube.com/@TREYtheExplainer,UCOuWeOkMrq84u5LY6apWQ8Q,TREY the Explainer,How Jesus Got A Beard,DK-6VHV8X1M,2025-07-18T19:00:12+00:00
Animals and Biology,http://www.youtube.com/@eons,UCzR-rom72PHN9Zg7RML9EbA,PBS Eons,When Dinosaurs Threw Up A Mystery,eNR5vjxUEdk,2025-07-22T14:01:06+00:00
Animals and Biology,http://www.youtube.com/@TierZoo,UCHsRtomD4twRf5WVHHk-cMw,TierZoo,Are Spiders OP?,qOJdxg97bl4,2025-08-13T19:57:45+00:00
Animals and Biology,http://www.youtube.com/@SallyLePage,UC9AUeAvdEVJfyS9rd9pvp8g,Sally Le Page,Is all plastic inherently evil?,0t-OA1lym2s,2021-06-14T15:00:02+00:00
Animals and Biology,http://www.youtube.com/@zefrank,UCVpankR4HtoAVtYnFDUieYA,Ze Frank,Katydid Vs. Bat,_qXoI8eXNZs,2025-08-15T15:01:03+00:00
Animals and Biology,http://www.youtube.com/@KQEDDeepLook,UC-3SbfTPJsL8fJAPKiVqBLg,Deep Look,Beach Day? These 5 Surprising Creatures Are Hanging Out Too | Deep Look,lSIZPFQFVoU,2025-08-05T15:04:32+00:00
Animals and Biology,http://www.youtube.com/@EVNautilus,UC1KOOWHthbQVXH2kZue3_xA,EVNautilus,"Believe it or not, this grumpy looking Sladenia #anglerfish is actually a #deepsea predator!",ktZOUTO7AOE,2025-08-15T19:28:25+00:00
Animals and Biology,http://www.youtube.com/@BizarreBeasts,UC9Lp_AA5M2cMGrlvnnIns-g,Bizarre Beasts,We Blind-Ranked Blobby Beasts,sb9jO93JNRQ,2025-08-11T16:01:40+00:00
Animals and Biology,http://www.youtube.com/@cmkosemen,UCMy7mRjghOxB8h3nv60SU4w,cmkosemen,Sweltering Summer 💥 STREAM HOUR,iEf-cKWah_c,2025-08-07T09:45:20+00:00
Animals and Biology,http://www.youtube.com/@HistoryoftheEarth,UC_aOteuWIY8ITg7DQQspG1g,History of the Earth,What Was The First Brain? ,6fd-Q_Lxn_s,2025-06-28T16:58:03+00:00
Animals and Biology,http://www.youtube.com/@ClintsReptiles,UCH18915fTE6yZzKrqdea8RQ,Clint's Reptiles,"The Coolest Snake You've Never Heard Of - File Snake, The Best Pet Reptile?",YAkl3jEG1Hc,2025-08-09T12:01:08+00:00
Animals and Biology,http://www.youtube.com/@AronRa,UCAJfDidJyukTekgSRZrjadw,AronRa,Reptilian Aliens in the Illuminati,P032ifXXGDs,2025-08-14T20:14:19+00:00
Animals and Biology,http://www.youtube.com/@journeytomicro,UCBbnbBWJtwsf0jLGUwX5Q3g,Journey to the Microcosmos,infinite microcosmos 🔬 lofi microbes to relax/study to,D6xs174c55g,2025-07-18T13:20:55+00:00
Animals and Biology,http://www.youtube.com/@Phrenotopia,UCO-8Osf4S3N0m7u1NivTfeg,Phrenotopia,Earth Analogues | Other Worlds ep. 5,F_MfQ3r73zA,2025-08-09T21:00:06+00:00
Animals and Biology,http://www.youtube.com/@octolabtv1168,UCNo_xQ7NvTr31naPAcjQWjg,Octolab TV,Octopus Christmas Tree Shopping,vrthz3HdlPE,2021-12-25T16:08:17+00:00
Animals and Biology,http://www.youtube.com/@KOTARO_OTTER,UCDYyCQAk60CqabvkL5gU3Mw,KOTSUMET,なぜかやめられないカワウソ達の変わった習慣　 Our Otters are Into Some Odd Stuff,GMGDyXm0EHQ,2025-08-09T11:00:27+00:00
Animals and Biology,http://www.youtube.com/@NinjaFrog777,UCrJH2Wy7PmCiitXKJ21yh4w,Ninja Frog,Too Round to Jump - Potato Fairy Music,wL5l6J9DJsE,2025-08-03T01:00:54+00:00
Animals and Biology,http://www.youtube.com/@cruiser1228,UCWIxPuO_0emPbma8UlOc3JQ,Cruiser,164 Bucky's dominance move toward 820 is to pee! BF Aug 15 2025 explore.org,BIVZZNHJVrM,2025-08-16T02:06:39+00:00
Animals and Biology,http://www.youtube.com/@cherylb4420,UCpjhDz9Sqn-6h1ZwtvUiA2g,Cheryl B,11/4/2022 LS Young Polar bears playing Explore.org,3Z78ZvO4_nk,2022-11-06T05:27:53+00:00
Animals and Biology,http://www.youtube.com/@Mr.Frog.,UCWUH_hdDfzi98i3clGbh_Ww,Mr. Frog,Life won’t wait！frog vs toad.,HXdc1cFi-_s,2024-12-21T23:56:31+00:00
Animals and Biology,http://www.youtube.com/@HomuraHam,UCKwcMBhbzQXgSM1T3TvHmiA,Homura Ham,Minecraft in Real Life: Hamster Maze Adventure 🐹 Homura Ham,3Hq88Lnxa2Q,2025-08-01T06:00:04+00:00
Animals and Biology,http://www.youtube.com/@TheUrbanRescueRanch,UCv3mh2P-q3UCtR9-2q8B-ZA,The Urban Rescue Ranch,I Finally Did It.,_SQznKhDHcQ,2025-07-15T22:00:39+00:00
Animals and Biology,http://www.youtube.com/@LOUTRE,UCz6yuUg6N0iRiFhCLmXrNJQ,LOUTRE,カワウソのワイルドな一面 #shorts,yCjzxukeJKc,2025-08-15T13:59:23+00:00
Animals and Biology,http://www.youtube.com/@Bradybrandwood,UCj2Eeg01Mn5WmcXxt695fUg,Brady Brandwood,Feeding My Pet Lobster Crablegs & Hand Feeding Sly The Octopus & A Sad Find In An Old Well,MMNCduXq6d4,2025-08-01T12:18:16+00:00
Animals and Biology,http://www.youtube.com/@FOBBVCAM,UCsFgbVuhRrPV5FqyN7kOD8g,FOBBV CAM,8-6-2025 Cactus Snag Is A Popular Hangout Spot,tWS8EC6GvMs,2025-08-07T19:23:38+00:00
Animals and Biology,http://www.youtube.com/@wrinkletheduck,UCPPjuJTt9jiOZNHScvEmvRg,seDUCKtive,“Here’s Ducky..”,wgd57Z3ClTE,2025-08-11T17:32:16+00:00
Animals and Biology,http://www.youtube.com/@ApolloandFrens,UCnUdaxbBMPQ9o9KVz7Oa6eQ,Apollo and Frens,He Wants Water 💧,Mre12GUtMGQ,2025-08-15T20:18:41+00:00
Animals and Biology,http://www.youtube.com/@davidmbird,UC6q7I1DD2Jv5Ur9UEIavIrA,Becorns | David M Bird,Becorns Discover Love In a Puff,gXU4MBMWwkg,2025-08-06T15:44:36+00:00
Animals and Biology,http://www.youtube.com/@LesleytheBirdNerd,UCDjdXwT-KrFPsqOSg4KL8Nw,Lesley the Bird Nerd,"Every Year, This Chickadee Raises a Family in My Backyard Nestbox",bLaFd5POFrg,2025-07-27T17:30:10+00:00
Animals and Biology,http://www.youtube.com/@MyBackyardBirding,UCcNyzOCKvyMBaA4iQVgO9EQ,MyBackyardBirding,Wildlife Needs Fresh Water,nseOlQLjUKo,2025-08-15T14:51:29+00:00
Animals and Biology,https://www.youtube.com/@OctopusLady,UC8_YhCUr_HRsLAtSddGeFcw,The Octopus Lady,TierZoo's Mollusk Video is a HATE CRIME,KGsBqMILGgY,2025-07-24T02:59:31+00:00
Making Things (Chaotic),https://www.youtube.com/@williamosman,UCfMJ2MchTSW2kWaT0kK94Yw,William Osman,we made a show - SCARE THE COYOTE - Ep 1,mjy0HQaKThc,2025-06-18T13:30:41+00:00
Making Things (Chaotic),http://www.youtube.com/@MichaelReeves,UCtHaxi4GTYDpJgMSGy7AeSw,Michael Reeves,good boyfriend,u0KPa34PoZA,2025-06-28T21:31:36+00:00
Making Things (Chaotic),http://www.youtube.com/@styropyro,UCJYJgj7rzsn0vdR7fkgjuIA,styropyro,2025 world's strongest handheld laser,UBVlL0FNbSE,2025-05-30T18:00:10+00:00
Making Things (Chaotic),http://www.youtube.com/@WilliamOsman2,UCbguawtJlHjxXzdAskubQVg,William Osman 2,the postmaster finally sent me a letter,5fa2KAUqIzk,2025-08-09T19:41:08+00:00
Making Things (Chaotic),http://www.youtube.com/@allenpan,UCVS89U86PwqzNkK2qYNbk5A,Allen Pan,flamethrower + ice thrower gauntlets,AdTw4ZKE0HA,2025-08-11T21:33:54+00:00
Making Things (Chaotic),http://www.youtube.com/@Ididathing,UCJLZe_NoiG0hT7QCX_9vmqw,I did a thing,tooth wrench,9FTzaNNwfOo,2025-07-02T14:00:27+00:00
Making Things (Chaotic),http://www.youtube.com/@ElectroBOOM,UCJ0-OtVpF0wOKEqT2Z1HEtA,ElectroBOOM,Grounding Yourself Can Be Bad! #science #technology #electrical #funny,bIMQO0Q4iRc,2025-08-06T17:16:40+00:00
Making Things (Chaotic),http://www.youtube.com/@Glarses,UCFtOX-21N1earf-K58C7HjQ,Glarses,tall keycaps,TS-wIVoNcWI,2025-06-18T09:21:49+00:00
Making Things (Chaotic),http://www.youtube.com/@ExtractionsAndIre,UCvFApMFo_AafXbHRyEJefjA,Extractions&Ire,Big Chem ain’t Easy-Big Cubane 2025,xSnfpubihgk,2025-06-30T13:53:55+00:00
Making Things (Chaotic),http://www.youtube.com/@ExplosionsAndFire,UCVovvq34gd0ps5cVYNZrc7A,Explosions&Fire,dont send that Plutonium guy to jail,M0JGsSxBd2I,2025-04-05T00:44:47+00:00
Making Things (Chaotic),http://www.youtube.com/@NileRed2,UCA0mlN90EHCizvo101nbr-g,NileRed 2,This is what REALLY happened at Polaroid,7Jkbug2l9K8,2023-04-04T21:15:30+00:00
Making Things (Chaotic),http://www.youtube.com/@NileBlue,UC1D3yD4wlPMico0dss264XA,NileBlue,Turning chocolate milk into a powder,ZUHfhWdeIWw,2025-07-29T17:30:38+00:00
Making Things of Various Sorts,http://www.youtube.com/@StuffMadeHere,UCj1VqrHhDte54oLgPG4xpuQ,Stuff Made Here,Baking brownies from the inside out,dXIkUkwzTQU,2025-06-02T03:20:42+00:00
Making Things of Various Sorts,http://www.youtube.com/@NileRed,UCFhXFikryT4aFcLkLw2LBLA,NileRed,Making a squishy rubber bouncy ball from scratch,tERigvFwLrM,2025-08-14T17:09:32+00:00
Making Things of Various Sorts,http://www.youtube.com/@thethoughtemporium,UCV5vCi3jPJdURZwAOO_FNfQ,The Thought Emporium,Tattooing Tardigrades with Teeny Tiny... electrons.,HG_FtWiqq28,2025-08-11T04:37:48+00:00
Making Things of Various Sorts,http://www.youtube.com/@tom7,UC3azLjQuz9s5qk76KEXaTvA,suckerpinch,Badness 0 (Apostrophe‛s version),Y65FRxE7uMc,2024-06-07T01:15:12+00:00
